id,response rate,accuracy,"top, more powerful",,"top, less powerful",,"bottom, more powerful",,"bottom, less powerful",,"left, more powerful",,"left, less powerful",,"right, more powerful",,"right, less powerful",,top-down,,bottom-up,,left-right,,right-left,,free response,#1 visualization,#1 direction,#1 correct,#2 visualization,#2 direction,#2 correct,#3 visualization,#3 direction,#3 correct,#4 visualization,#4 direction,#4 correct,how to make it easier
77,89.58%,30.23%,nan nan,0/4,nan nan,0/5,1051 30,2/7,975 278,3/9,622 0,1/8,1278 203,2/3,1185 0,1/5,1232 147,4/7,975 278,3/13,1051 30,2/12,1110 277,5/15,1247 172,3/8,"First I would think about which people were less powerful (if the number was orange) or which people were more powerful (if the number was blue).  Then, if the number was big (3 or 4) I would try to remember which people were really powerful (or not powerful) compared to the reference person.  If the numer was 1 or 2 it was harder for me to decide which one to pick and I would either run out of time to pick an anwer or I ended up guessing.  =",down,DOWN,True,up,UP,False,right,DOWN,False,up,UP,False,I felt like I could have used a couple more seconds when trying to decide between the 4 people.  I felt like I didn't have enough time to decide and felt rushed while trying to pick an answer.=
78,95.83%,41.30%,850 188,5/9,887 290,3/4,919 212,3/6,1030 40,3/9,820 0,1/4,1008 392,2/4,930 320,2/5,nan nan,0/7,917 174,8/18,903 255,6/10,820 0,1/11,969 360,4/9,"In the first task I came up with a general order as I was going. The top and bottom were really clear, but the middle people were harder to remember. Before the 4 choices appeared I tried to think of the person who would apply. Sometimes I would remember names, but most of the time I just tought about the color of the shit they were wearing. It was pretty difficult to count it from meory with the short pause in between.",up,UP,True,down,DOWN,True,up,UP,True,down,DOWN,False,Doing the third task of ordering them before the 2nd task of asking who is below or above woud make the task easier because it is easier to visualize it.
79,97.91%,70.21%,631 167,3/4,477 104,5/8,568 71,2/5,585 73,4/5,541 58,4/5,524 126,3/4,569 224,9/10,616 186,3/7,604 124,7/9,503 104,7/13,573 135,7/12,558 205,12/14,"I attempted to assign numbers to the faces that I learned previously. So, initially, I knew that Madison and Hannah were number 1 and 2 respectively, but wasn't sure numerically where everyone else was. During the short time period, I'd symbolically tap the desk to simulate a hierarchy to count on, almost like a totem pole.",up,UP,True,down,DOWN,True,down,DOWN,True,up,UP,True,"I think that it should retain a decent amount of difficulty, as it forces the participant to form the strategies that it seems the experiment is looking for."
80,87.5%,19.04%,nan nan,0/3,285 0,1/11,237 0,1/6,194 0,1/4,nan nan,0/6,235 0,1/3,222 65,2/9,650 22,2/6,194 0,1/7,261 24,2/17,650 22,2/12,227 53,3/12,It was very difficult to actully make an accurate decision as the the time allowed to pick a face was probably less than a second and therefore I had no time to actually even review all 4 faces and ultimately I had to spend my effort on just making sure I pushed any button instead of the right button becaue the time allowed to make an acutal selecton was too quick to actually review the faces and make the right choice.,down,UP,True,up,UP,True,none,DOWN,False,down,DOWN,True,The time allowed to make the right decision during the second task needs to be increased
81,87.5%,33.33%,nan nan,0/2,18 0,1/4,58 20,3/11,519 0,1/4,337 0,1/6,298 245,4/9,230 132,3/5,1077 0,1/7,519 0,1/6,48 24,4/15,707 370,2/13,269 207,7/14,just pairing and memorizing,down,DOWN,False,right,UP,False,down,UP,False,right,DOWN,True,no
82,89.58%,25.58%,1027 210,3/5,949 0,1/7,633 292,2/8,nan nan,0/2,868 312,3/8,nan nan,0/9,329 0,1/3,461 0,1/6,1027 210,3/7,739 281,3/15,766 323,4/14,329 0,1/12,"I tried to remember all the positions of different people but it didn't help to reach the correct answer. 

I did not typically had any feelings during the period as I was trying to remember those people.=",up,UP,False,left,DOWN,False,up,DOWN,False,left,UP,False,"allow longer time for choosing
="
83,94.44%,19.11%,933 315,2/8,1087 0,1/9,1451 0,1/7,565 46,2/12,nan nan,0/9,1145 204,2/8,1022 433,2/12,1261 79,3/7,749 291,4/20,1269 182,2/16,1261 79,3/16,1083 344,4/20,"I found the task to be very difficult considering the choices appeared very fast and most of the time I did not have enough time to look at them all. I did no use any memory tricks. I noticed that during the period after the reference face and number appeared, but before the choices appeared, I was given time think about what I was going to reply without the options in front of me. I used this time to cross eliminate who I thought was not the correct choice and think about the people I thought were a possibility. Once the choices appared, if saw someone I thought could be the answer I chose it.",up,DOWN,False,down,DOWN,False,right,UP,False,right,UP,True,The only thing I think could make this task easier is leaving the choices up for a couple of more seconds. It rushed me and I believe I did not have accurate responses due to the time constraint.
84,86.11%,24.19%,661 163,3/13,919 0,1/8,1005 299,2/12,760 0,1/9,538 0,1/5,940 0,1/8,829 259,2/6,1251 125,4/11,686 147,4/22,977 248,3/20,1109 306,5/16,866 218,3/14,"I used general grouping of where I thought people were based on the trial runs of the first task because it compared people of similar powr and then as I worked my way through the task I began using a visual representation in my min of the power hierarchy. 
During the described period, I would trace up and down the 'ladder' in my head.",down,DOWN,True,down,DOWN,True,down,UP,True,down,UP,False,The time that was given to view the faces was not enough for me to see if the face I had in mind was there
